{
  "$schema": "../../schemas/skill-review.schema.json",
  "schema_version": "0.1.0",
  "review_id": "v0.4.0/shared-project-permissions-triage",
  "release": "v0.4.0",
  "target_maturity": "reviewed",
  "skill": {
    "id": "shared-project-permissions-triage",
    "version": "0.2.0",
    "maturity": "seed",
    "risk_level": "low"
  },
  "quality_snapshot": {
    "score": 100,
    "band": "strong",
    "gaps": []
  },
  "evidence": {
    "readme": "skills/shared-project-permissions-triage/README.md",
    "examples": [
      "skills/shared-project-permissions-triage/examples/permission-triage.sh",
      "skills/shared-project-permissions-triage/examples/review-permission-evidence.py",
      "skills/shared-project-permissions-triage/examples/support-review-checklist.md"
    ],
    "benchmark_cases": [
      "benchmarks/cases/shared-permissions-fixture.json"
    ],
    "agent_tasks": [
      "agent-bench/tasks/shared-permissions-safety.json"
    ],
    "adoption_reports": []
  },
  "review_issue": null,
  "review_commit": null,
  "domain_reviews": [],
  "safety_reviews": [],
  "decision": {
    "status": "pending",
    "decided_by": null,
    "decided_at": null,
    "notes": "Awaiting public issue routing, domain review, and admin-scope safety review."
  }
}
